conversation_id_str;created_at;favorite_count;Label;;full_text;id_str;image_url;in_reply_to_screen_name;lang;location;quote_count;reply_count;retweet_count;tweet_url;user_id_str;username;
1,90619E+18;Sun Mar 30 03:33:46 +0000 2025;0;Positif;414;Program Makan Bergizi Gratis (MBG) adalah langkah strategis pemerintah dalam mengurangi angka kemiskinan dengan memastikan anak-anak mendapatkan gizi yang baik sejak dini. #MakanBergiziGratis #MBG https://t.co/ho50CgBX26;1,90619E+18;https://pbs.twimg.com/media/GnQj8yKWwAAZcZJ.jpg;;in;Namba, Japan;0;0;0;https://x.com/ravidnath/status/1906188071764172801;1366085646;ravidnath;
1,90634E+18;Sun Mar 30 13:56:29 +0000 2025;1;Positif;415;Program makan bergizi gratis beri asupan gizi terbaik untuk masa depan yang lebih baik #MBG https://t.co/y6sQlqJZpw;1,90634E+18;https://pbs.twimg.com/media/GnSyelZboAAog6b.jpg;;in;Indonesia;0;0;0;https://x.com/baronben_/status/1906344783922278439;1,5645E+18;baronben_;
1,90637E+18;Sun Mar 30 15:47:14 +0000 2025;0;Positif;416;Program makan bergizi gratis bertujuan agar siswa di Indonesia bisa lepas dari stunting serta mampu menyiapkan Indonesia menuju keemasan. #PenuhiGiziIndonesia https://t.co/EZ3H35tgkL;1,90637E+18;https://pbs.twimg.com/media/GnTLzZ2bUAAbkGV.jpg;;in;;4;2;0;https://x.com/arkan_aksawa/status/1906372656548438443;1,70758E+18;arkan_aksawa;
1,90033E+18;Thu Mar 13 23:22:35 +0000 2025;255;Positif;417;Gubernur Jakarta Gandeng Badan Gizi Nasional Dorong Transformasi Kantin Sekolah sebagai Pelengkap MBG #MakanBergiziGratis https://t.co/Tt6kbDFiMI;1,90033E+18;https://pbs.twimg.com/ext_tw_video_thumb/1900326613369446401/pu/img/4oLstGlvQyMZ4Toj.jpg;;in;Penajam Paser Utara;0;252;248;https://x.com/KotaNusantara/status/1900326655366963315;922669790;KotaNusantara;
1,90633E+18;Sun Mar 30 12:42:48 +0000 2025;1;Positif;418;Anak-anak di Papua menerima Makan Bergizi Gratis dengan sukacita #papua #papuatengah #papuahits #jayapura #nabire #jayawijaya #merauke #mbg #mbgpapua #MBGMajukanPapua https://t.co/Btjg7GXVpJ;1,90633E+18;https://pbs.twimg.com/media/GnShnaIbIAAioVI.jpg;;in;;0;0;0;https://x.com/FitriAulia92_/status/1906326243680849988;1,35694E+18;FitriAulia92_;
1,90619E+18;Sun Mar 30 03:22:34 +0000 2025;0;Positif;419;Tahukah Kamu? Program Makan Bergizi Gratis dapat meningkatkan kecerdasan gizi dan kesejahteraan anak-anak di seluruh wilayah Indonesia. Dukung terus! #MakanBergiziGratis #MBG #ProgramMakanBergiziGratis #ManfaatMBG https://t.co/aTRbEsBw2r;1,90619E+18;https://pbs.twimg.com/media/GnQhYSDagAAjqB4.jpg;;in;Jambi, Indonesia;0;1;0;https://x.com/fikri_rasyid33/status/1906185252415955383;1,52577E+18;fikri_rasyid33;
1,90623E+18;Sun Mar 30 06:17:26 +0000 2025;0;Positif;420;Program Makan Bergizi Gratis Dorong UMKM dan Perkuat Ekonomi Rakyat #MakanBergiziGratis #IndonesiaSehat https://t.co/2eCUoFdE5R;1,90623E+18;https://pbs.twimg.com/media/GnRJaYuWEAA29Fj.jpg;;in;Banten, Indonesia;0;0;0;https://x.com/dinosartos/status/1906229262517969224;2506280550;dinosartos;
1,90621E+18;Sun Mar 30 05:16:01 +0000 2025;1;Netral;421;MANFAAT MAKAN BERGIZI GRATIS #MakanBergiziGratis #MBG #ProgramMakanBergiziGratis #ManfaatMBG https://t.co/ZdAWxmPert;1,90621E+18;https://pbs.twimg.com/media/GnQ7WntaIAAfCn3.jpg;;in;Palembang, South Sumatra;0;1;0;https://x.com/derryakbr/status/1906213804595351981;1,56439E+18;derryakbr;
1,90637E+18;Sun Mar 30 15:46:20 +0000 2025;0;Positif;422;Program makan bergizi gratis bertujuan agar siswa di Indonesia bisa lepas dari stunting serta mampu menyiapkan Indonesia menuju keemasan. #PenuhiGiziIndonesia https://t.co/lC2vWMpqdB;1,90637E+18;https://pbs.twimg.com/media/GnTLmqWaUAEQpcc.jpg;;in;;2;2;0;https://x.com/arkan_aksawa/status/1906372430727397846;1,70758E+18;arkan_aksawa;
1,90634E+18;Sun Mar 30 13:33:49 +0000 2025;0;Positif;423;Sungguh luar biasa Kebahagiaan anak-anak pelajar di Papua menerima makan bergizi gratis Selamat Hari Raya Idul Fitri 2025 M Syahrini mudik Ramadhan Dirumah Selamat Lebaran Eid Mubarak Minal Mohon Allah SWT Maafin Taqabbalallahu Minna Wa Minkum Opor Ketupat Rendang https://t.co/GeRQ2erugM;1,90634E+18;https://pbs.twimg.com/media/GnStL5CakAAnu8A.jpg;;in;Cruising on a cloud;0;0;0;https://x.com/jay_amour/status/1906339079379436019;134635640;jay_amour;
1,90637E+18;Sun Mar 30 15:46:43 +0000 2025;0;Positif;424;Makan bergizi gratis untuk meningkatkan kualitas hidup generasi bangsa #PenuhiGiziIndonesia https://t.co/14FRv8o6m8;1,90637E+18;https://pbs.twimg.com/media/GnTLs77aAAAI6Nq.jpg;;in;;4;2;0;https://x.com/arkan_aksawa/status/1906372527263522909;1,70758E+18;arkan_aksawa;
1,90633E+18;Sun Mar 30 12:49:18 +0000 2025;1;Positif;425;Tokoh Agama mendukung Program Makan Bergizi Gratis (MBG) #papua #papuatengah #papuahits #jayapura #nabire #jayawijaya #merauke #mbg #mbgpapua #MBGMajukanPapua https://t.co/RuA4jZDfmB;1,90633E+18;https://pbs.twimg.com/media/GnSjGjsaUAAYP_i.jpg;;in;;0;0;0;https://x.com/FitriAulia92_/status/1906327879119732900;1,35694E+18;FitriAulia92_;
1,90637E+18;Sun Mar 30 15:46:36 +0000 2025;0;Positif;426;Program Makan Bergizi Gratis terbukti beri segudang manfaat untuk kesehatan dan perekonomian masyarakat #PenuhiGiziIndonesia https://t.co/ZnviQwEqs0;1,90637E+18;https://pbs.twimg.com/media/GnTLo_4b0AEu0yT.jpg;;in;;2;2;0;https://x.com/arkan_aksawa/status/1906372496066326968;1,70758E+18;arkan_aksawa;
1,90183E+18;Tue Mar 18 02:58:24 +0000 2025;272;Positif;427;"#SobatTernak Weekend produktif Dirjen PKH langsung turun ke lapangan untuk cek kesiapan peternak dlm mendukung program #MBG Makan Bergizi Gratis Program ini bertujuan memastikan anak-anak mendapatkan asupan gizi yg terbaik &amp; semua dimulai dari peternakan yg siap #DitjenPKH https://t.co/SD7pVy350T";1,90183E+18;https://pbs.twimg.com/amplify_video_thumb/1901830254571991040/img/-pmyDZeLcxsbVU-E.jpg;;in;Jakarta Selatan, DKI Jakarta;4;86;46;https://x.com/ditjen_pkh/status/1901830517731020901;8,97272E+17;ditjen_pkh;
1,90608E+18;Sat Mar 29 20:10:55 +0000 2025;11;Positif;428;? Suara dari Intan Jaya: Makan Bergizi Gratis untuk Masa Depan Anak Papua @kumparan #MakanBergiziPapua #AnakSehatAnakCerdas #PapuaBangkit https://t.co/WQA8m1qDlk;1,90608E+18;https://pbs.twimg.com/amplify_video_thumb/1906076546361958400/img/gZIyro7LHNim47vL.jpg;;in;;0;10;0;https://x.com/OggyZilly43173/status/1906076624220750015;1,82615E+18;OggyZilly43173;
1,90619E+18;Sun Mar 30 03:34:03 +0000 2025;0;Positif;429;Melalui Program Makan Bergizi Gratis (MBG) pemerintah berkomitmen meningkatkan kesejahteraan masyarakat Indonesia khususnya anak-anak dengan menyediakan gizi yang baik setiap harinya. #MakanBergiziGratis #MBG https://t.co/Y1QYuU2o5B;1,90619E+18;https://pbs.twimg.com/media/GnQkBE8WUAA0Znc.jpg;;in;Namba, Japan;0;1;0;https://x.com/ravidnath/status/1906188145655177435;1366085646;ravidnath;
1,90405E+18;Mon Mar 24 06:13:03 +0000 2025;15579;Negatif;430;makan bergizi yang kami mau tuh gini pak https://t.co/adVVokku7P;1,90405E+18;https://pbs.twimg.com/media/GmyO3hlbEAAru_2.jpg;;in;camaba akuntan;73;21;6391;https://x.com/shemangat/status/1904053832621105221;1,35153E+18;shemangat;
1,90198E+18;Tue Mar 18 12:36:47 +0000 2025;2025;Negatif;431;PEMISKINAN STRUKTURAL Coba tanyakan pada warga disini Penting mana makan gratis atau bangun jalan Pasti mereka jawab bangun jalan Tapi pemerintah budeg Anggaran infrastruktur dipotong 80% untuk makan gratis https://t.co/wIXYdLLyl9;1,90198E+18;https://pbs.twimg.com/ext_tw_video_thumb/1901975645359636480/pu/img/IpcXhcqAokg39dGq.jpg;;in;;16;75;959;https://x.com/MurtadhaOne1/status/1901976073451229382;1,17895E+18;MurtadhaOne1;
1,90433E+18;Tue Mar 25 00:43:50 +0000 2025;369;Netral;432;Sedikit catatan soal paper dampak Makan Bergizi Gratis ke perekonomian nasional. Saya fokus ke metode IO-nya dan elaborasi komentar saya di acara doctrine UK. This isnt exhaustive dan mungkin bakal gw edit dikit nanti. Yg mo ikut komen yuk! https://t.co/FlWstCidCK;1,90433E+18;;;in;;10;10;98;https://x.com/iMedKrisna/status/1904333367950401545;9,89423E+17;iMedKrisna;
1,90621E+18;Sun Mar 30 05:16:04 +0000 2025;0;Positif;433;Salut buat yang udah dukung Makan Bergizi Gratis di Papua terus lanjutkan dukungan kita #PapuaDukungMBG https://t.co/czUQhkNYQq;1,90621E+18;https://pbs.twimg.com/ext_tw_video_thumb/1906213717190307840/pu/img/Ku35w2sMSwLm_cQj.jpg;;in;97L ;0;0;0;https://x.com/usnicorns/status/1906213816112910475;7,63785E+17;usnicorns;
1,90633E+18;Sun Mar 30 12:45:15 +0000 2025;1;Positif;434;Dukung Program Makan Bergizi Gratis untuk anak-anak di Papua #papua #papuatengah #papuahits #jayapura #nabire #jayawijaya #merauke #mbg #mbgpapua #MBGMajukanPapua https://t.co/EIiwURUhMU;1,90633E+18;https://pbs.twimg.com/ext_tw_video_thumb/1906326808515248128/pu/img/cgxCf4EAVfzzn_5J.jpg;;in;;0;0;0;https://x.com/FitriAulia92_/status/1906326856485515483;1,35694E+18;FitriAulia92_;
1,90515E+18;Thu Mar 27 07:07:05 +0000 2025;2913;Negatif;435;"Dosen kasih gratis uang semester : kujamin uang semester gratis tapi islik dulu ;gw bkin siom ketagihan dah.. : aduhh yg gini bikin susah nahan : gmn lagi gnjotna... https://t.co/3KGz0yuWB6 https://t.co/2gXU4m1zBx";1,90515E+18;https://pbs.twimg.com/media/GnB4AOxbAAAiEAq.jpg;;in;;0;37;275;https://x.com/memtega/status/1905154591798276224;1294682546;memtega;
1,89924E+18;Mon Mar 10 23:13:43 +0000 2025;258;Positif;436;Program MBG Tetap Jalan Selama Ramadan dengan Penyesuaian Khusus #MakanBergiziGratisRamadhan https://t.co/yQhjDt7RMW;1,89924E+18;https://pbs.twimg.com/media/GltyOAebMAA51tK.jpg;;in;Penajam Paser Utara;0;242;245;https://x.com/KotaNusantara/status/1899237260329148700;922669790;KotaNusantara;
1,90518E+18;Thu Mar 27 08:30:40 +0000 2025;9085;Netral;437;?Spot Recharge Energy? Tersedia makanan dan minuman buka puasa untuk teman-teman yang ikut turun kejalan hari ini. @barengwarga #CabutUUTNI #TolakUUTNI https://t.co/EM9mJ2jaW8;1,90518E+18;https://pbs.twimg.com/media/GnCLH-waoAAixhc.jpg;;in;;61;183;4656;https://x.com/nctzenhumanity/status/1905175626010542338;1,57799E+18;nctzenhumanity;
1,90634E+18;Sun Mar 30 13:41:10 +0000 2025;0;Netral;438;Tokoh Agama Papua mendukung Program Makan Bergizi Gratis untuk anak-anak Pelajar Selamat Hari Raya Idul Fitri 2025 M Syahrini mudik Ramadhan Dirumah Selamat Lebaran Eid Mubarak Minal Mohon Allah SWT Maafin Taqabbalallahu Minna Wa Minkum Opor Ketupat Rendang pakyandrisusanto https://t.co/4fpEpbi8Uy;1,90634E+18;https://pbs.twimg.com/media/GnSu9VgbkAAdzWI.jpg;;in;Cruising on a cloud;0;0;0;https://x.com/jay_amour/status/1906340928765464777;134635640;jay_amour;
1,90619E+18;Sun Mar 30 03:25:37 +0000 2025;1;Positif;439;Tahukah Kamu? Program Makan Bergizi Gratis dapat meningkatkan kecerdasan gizi dan kesejahteraan anak-anak di seluruh wilayah Indonesia. Dukung terus! #MakanBergiziGratis #MBG #ProgramMakanBergiziGratis #ManfaatMBG https://t.co/nU65pnNnmB;1,90619E+18;https://pbs.twimg.com/media/GnQiFbDbMAArnjk.jpg;;in;East Nusa Tenggara, Indonesia;0;0;0;https://x.com/rikywolf444/status/1906186021995438176;1,56319E+18;rikywolf444;
1,90618E+18;Sun Mar 30 03:13:10 +0000 2025;0;Positif;440;Makan Bergizi Gratis Untuk Masa Depan Yang Cerah #makanbergizigratis #papua #anakbangsa https://t.co/VCu1hdxVOS;1,90618E+18;https://pbs.twimg.com/ext_tw_video_thumb/1906182781954375681/pu/img/33wuNcrKL88apmTd.jpg;;in;;0;0;0;https://x.com/LumbungPolitik/status/1906182888757846232;1,86632E+18;LumbungPolitik;
1,90633E+18;Sun Mar 30 12:47:07 +0000 2025;1;Positif;441;Tokoh Adat mendukung Program Makan Bergizi Gratis (MBG) #papua #papuatengah #papuahits #jayapura #nabire #jayawijaya #merauke #mbg #mbgpapua #MBGMajukanPapua https://t.co/iflV5xytnx;1,90633E+18;https://pbs.twimg.com/media/GnSimaSbwAA6ZQD.jpg;;in;;0;0;0;https://x.com/FitriAulia92_/status/1906327325953974763;1,35694E+18;FitriAulia92_;
1,90019E+18;Thu Mar 13 14:33:15 +0000 2025;1395;Negatif;442;Makan Bergizi Gratis vs Jalan Bagus Gratis. Kamu pilih yang mana...? https://t.co/CS4oXtmxek;1,90019E+18;https://pbs.twimg.com/ext_tw_video_thumb/1900193347916226563/pu/img/s9-r4iZv2noJpGTW.jpg;;in;;18;102;577;https://x.com/MarahIchsan/status/1900193444422922438;7,97761E+17;MarahIchsan;
1,90619E+18;Sun Mar 30 03:57:21 +0000 2025;0;Netral;443;Tahukah Kamu? Program Makan Bergizi Gratis bantu tingkatkan kecerdasan dan gizi anak-anak di Indonesia! Dukung terus! #MakanBergiziGratis #MBG #ProgramMakanBergiziGratis #ManfaatMBG https://t.co/LQLGK2ug9U;1,90619E+18;;;in;jakarta;0;1;0;https://x.com/wajah_baruitu/status/1906194006658167147;1,56285E+18;wajah_baruitu;
1,90637E+18;Sun Mar 30 15:49:26 +0000 2025;0;Positif;444;Program makan bergizi gratis berdampak besar terhadap perkembangan generasi muda Indonesia #PenuhiGiziIndonesia;1,90637E+18;;;in;;0;0;0;https://x.com/rezareva_reza/status/1906373210373070902;1,83676E+18;rezareva_reza;
1,90623E+18;Sun Mar 30 06:05:56 +0000 2025;0;Positif;445;Program Makan Bergizi Gratis dapat meningkatkan kecerdasan gizi dan kesejahteraan anak-anak di seluruh wilayah Indonesia #MakanBergiziGratis #MBG #ProgramMakanBergiziGratis #ManfaatMBG https://t.co/qPj8TipuTN;1,90623E+18;https://pbs.twimg.com/ext_tw_video_thumb/1906226330313850880/pu/img/gbN92-PSGOtInlIt.jpg;;in;;0;0;0;https://x.com/Mel612Bangka/status/1906226366581743695;1,7254E+18;Mel612Bangka;
1,90623E+18;Sun Mar 30 06:37:33 +0000 2025;0;Positif;446;Program Makan bergizi Gratis Memberikan Asupan Bergizi Untuk Masa Depan Yang Lebih Sehat Cerdas dan Produktif #MakanBergiziGratis #MBG #ProgramMakanBergiziGratis #ManfaatMBG https://t.co/DsWkU7eCeJ;1,90623E+18;https://pbs.twimg.com/media/GnRN5jTaIAAVdW-.jpg;;in;JAKARTA;0;0;0;https://x.com/abibahagia/status/1906234321448436135;1508852330;abibahagia;
1,90629E+18;Sun Mar 30 10:29:32 +0000 2025;1;Positif;447;Setiap anak berhak tumbuh sehat dan cerdas! Program Makan Bergizi Gratis hadir untuk masa depan Indonesia. ????? #GiziUntukSemua #SehatBersama https://t.co/Kw3XuNLSfI;1,90629E+18;https://pbs.twimg.com/media/GnSCsP1bsAAgP0x.png;;in;Jakarta Capital Region;0;1;0;https://x.com/MelatiLela/status/1906292705573142606;1,38576E+18;MelatiLela;
1,9063E+18;Sun Mar 30 11:05:12 +0000 2025;1;Negatif;448;woaahhh bener aja makan bergizi gratis lebih penting daripada pendidikan;1,9063E+18;;;in;;0;0;0;https://x.com/jidantuiter/status/1906301680775561359;1,7537E+18;jidantuiter;
1,90641E+18;Sun Mar 30 18:27:30 +0000 2025;0;Netral;449;Hal baik tetap kita dukung cth: #MBG (Makan Bergizi Gratis) sebagai upy memastikan gizi ank terpenuhi tapi eksekusinya hrs didesentralisasi. Sekolah lebih phm kebutuhan spesifik muridnya dari menu lokal hingga budaya mkn dgn dana yg transparan dari negara. #DapurSekolahMandiri;1,90641E+18;;;in;Sidoarjo, Surabaya;0;0;0;https://x.com/ammarindo/status/1906412988221059329;55822519;ammarindo;
1,90619E+18;Sun Mar 30 03:34:24 +0000 2025;0;Positif;450;Program Makan Bergizi Gratis (MBG) memberikan asupan gizi yang dibutuhkan bagi masyarakat Indonesia terutama anak-anak untuk mendukung masa depan yang sehat cerdas dan produktif. #MakanBergiziGratis #MBG https://t.co/H7qdqmN6i4;1,90619E+18;https://pbs.twimg.com/media/GnQkGHrWsAAOVkB.jpg;;in;Namba, Japan;0;0;0;https://x.com/ravidnath/status/1906188232053690729;1366085646;ravidnath;
1,90618E+18;Sun Mar 30 03:11:35 +0000 2025;0;Negatif;451;Manfaat Makan Bergizi Gratis #papua #opm #kstp #kekejaman #knpb https://t.co/xCkHLBSpoI;1,90618E+18;https://pbs.twimg.com/media/GnQe3tebsAAtGZn.jpg;;in;;0;0;0;https://x.com/LumbungPolitik/status/1906182489024196841;1,86632E+18;LumbungPolitik;
1,90625E+18;Sun Mar 30 07:42:58 +0000 2025;0;Positif;452;Tahukah Kamu? Program Makan Bergizi Gratis dapat meningkatkan kecerdasan gizi dan kesejahteraan anak-anak di seluruh wilayah Indonesia. Dukung terus! #MakanBergiziGratis #MBG #ProgramMakanBergiziGratis #ManfaatMBG https://t.co/VTtRqwv3EV;1,90625E+18;;;in;??? .. closed ??;0;1;0;https://x.com/OfGeals/status/1906250784838148604;256994318;OfGeals;
1,90624E+18;Sun Mar 30 06:40:42 +0000 2025;1;Positif;453;Makan Bergizi Gratis untuk Tingkatkan Kualitas Gizi Anak Indonesia #MakanBergiziGratis #MBG #ProgramMakanBergiziGratis #ManfaatMBG https://t.co/gvgBP7qQTH;1,90624E+18;https://pbs.twimg.com/media/GnROutNagAAgNdN.jpg;;in;Palembang, South Sumatra;1;3;0;https://x.com/HantamanHijau/status/1906235115493044424;1,56809E+18;HantamanHijau;
1,90631E+18;Sun Mar 30 11:52:33 +0000 2025;1;Positif;454;Bantu anak-anak Papua tumbuh dengan senyum! Program makan bergizi gratis bukan sekadar bantuan tapi investasi untuk masa depan yang lebih baik. https://t.co/ntw645wctk;1,90631E+18;https://pbs.twimg.com/media/GnSWF8eaYAAGJuS.jpg;;in;;0;0;0;https://x.com/Nan4_ecia/status/1906313594205331806;1,75399E+18;Nan4_ecia;
1,90649E+18;Sun Mar 30 23:23:20 +0000 2025;0;Positif;455; Dukungan penuh dari Lembaga Masyarakat Adat Papua Barat Daya untuk program makan bergizi gratis. Ayo bangun #GenerasiPapuaTumbuhSehat! https://t.co/1mioZi0iYV;1,90649E+18;https://pbs.twimg.com/media/GnU0NwGaEAA9VNR.jpg;;in;;0;0;0;https://x.com/rseocita/status/1906487438845087938;1925761711;rseocita;
1,90634E+18;Sun Mar 30 13:40:54 +0000 2025;0;Positif;456;Tokoh Adat Papua mendukung Program Makan Bergizi Gratis untuk anak-anak Pelajar Selamat Hari Raya Idul Fitri 2025 M Syahrini mudik Ramadhan Dirumah Selamat Lebaran Eid Mubarak Minal Mohon Allah SWT Maafin Taqabbalallahu Minna Wa Minkum Opor Ketupat Rendang pakyandrisusanto https://t.co/iH28TLxZIb;1,90634E+18;https://pbs.twimg.com/media/GnSu1tia8AAWJGB.jpg;;in;Cruising on a cloud;0;0;0;https://x.com/jay_amour/status/1906340862977884302;134635640;jay_amour;
1,90623E+18;Sun Mar 30 06:04:47 +0000 2025;0;Positif;457;Program Makan Bergizi Gratis dapat meningkatkan kecerdasan gizi dan kesejahteraan anak-anak di seluruh wilayah Indonesia #MakanBergiziGratis #MBG #ProgramMakanBergiziGratis #ManfaatMBG https://t.co/FWDC7FfEIg;1,90623E+18;https://pbs.twimg.com/media/GnRGg6ebIAAT48j.jpg;;in;;0;0;0;https://x.com/Mel612Bangka/status/1906226075891552531;1,7254E+18;Mel612Bangka;
1,90618E+18;Sun Mar 30 03:13:21 +0000 2025;0;Positif;458;Makanan bergizi = masa depan cemerlang! Dukung Program Makan Bergizi Gratis untuk anak-anak Indonesia! #MakanBergiziGratis #MBG #ProgramMakanBergiziGratis #ManfaatMBG https://t.co/AGFQCmHYnT;1,90618E+18;https://pbs.twimg.com/media/GnQfDG6bcAILKS2.jpg;;in;jakarta;6;1;0;https://x.com/wajah_baruitu/status/1906182935101014246;1,56285E+18;wajah_baruitu;
1,90619E+18;Sun Mar 30 03:47:50 +0000 2025;0;Positif;459;Tahukah Kamu? Program Makan Bergizi Gratis dapat meningkatkan kecerdasan gizi dan kesejahteraan anak-anak di seluruh wilayah Indonesia. Dukung terus! #MakanBergiziGratis #MBG #ProgramMakanBergiziGratis #ManfaatMBG https://t.co/aO0mwUVzOV;1,90619E+18;https://pbs.twimg.com/media/GnQnKyHbsAARzEA.jpg;;in;Sumatera Utara, Indonesia;0;0;0;https://x.com/Kamto97182089/status/1906191612096507916;1,56444E+18;Kamto97182089;
1,90649E+18;Sun Mar 30 23:33:16 +0000 2025;0;Netral;460; Makan bergizi gratis dan dukungan adat formula sukses untuk #GenerasiPapuaTumbuhSehat dari Papua Barat Daya. https://t.co/jHCa6ZD49c;1,90649E+18;https://pbs.twimg.com/media/GnU2fUeawAA_mBN.jpg;;in;;0;0;0;https://x.com/arcgentina/status/1906489938826412156;9,34887E+17;arcgentina;
1,90634E+18;Sun Mar 30 13:33:51 +0000 2025;0;Netral;461;Program Makan Bergizi Gratis sangat bermanfaat untuk anak-anak pelajar di pedalaman papua Selamat Hari Raya Idul Fitri 2025 M Syahrini mudik Ramadhan Dirumah Selamat Lebaran Eid Mubarak Minal Mohon Allah SWT Maafin Taqabbalallahu Minna Wa Minkum Opor Ketupat Rendang https://t.co/K6CTYxKqMF;1,90634E+18;https://pbs.twimg.com/ext_tw_video_thumb/1906338942049542144/pu/img/T4SS4VoPYDUePmWy.jpg;;in;Bogorraincity?;0;0;0;https://x.com/ErlandoFauzi/status/1906339087394684957;215612190;ErlandoFauzi;
1,90624E+18;Sun Mar 30 06:58:13 +0000 2025;1;Positif;462;Program Makan Bergizi Gratis meningkatkan kecerdasan gizi dan kesejahteraan anak Indonesia. #MakanBergiziGratis #MBG #ProgramMakanBergiziGratis #ManfaatMBG https://t.co/k65rinFddI;1,90624E+18;https://pbs.twimg.com/media/GnRSvXgaAAAnwJZ.jpg;;in;Kota Solok, Sumatera Barat;0;0;0;https://x.com/CinduaMato9/status/1906239524038115682;1,52494E+18;CinduaMato9;
1,90649E+18;Sun Mar 30 23:15:03 +0000 2025;3111;Negatif;463;SORRY YEEEE Maafkan diri ini bila belum setransparan pembuatan RUU TNI ? Masih banyak salah seperti pendirian Danantara ? Acap berkata kasar dan mengucapkan Ndasmu Teriring salam dan kehangatan yang dapat memenuhi raga seperti Makan Bergizi Gratis Oke;1,90649E+18;;;in;;86;60;1363;https://x.com/keharyapatihan/status/1906485352518586669;345252211;keharyapatihan;
1,90619E+18;Sun Mar 30 03:26:01 +0000 2025;0;Positif;464;Tahukah Kamu? Program Makan Bergizi Gratis dapat meningkatkan kecerdasan gizi dan kesejahteraan anak-anak di seluruh wilayah Indonesia. Dukung terus! #MakanBergiziGratis #MBG #ProgramMakanBergiziGratis #ManfaatMBG https://t.co/QlNfRmQgZV;1,90619E+18;https://pbs.twimg.com/media/GnQiLFxbAAAWeIt.jpg;;in;Provinsi Kalimantan Utara;0;0;0;https://x.com/Inocantiksekali/status/1906186123086610826;1,54141E+18;Inocantiksekali;
1,90628E+18;Sun Mar 30 09:35:04 +0000 2025;0;Positif;465;Program makan bergizi gratis untuk meningkatkan kesejahteraan masyarakat ???? #MakanBergiziGratis #MBG #ProgramMakanBergiziGratis #ManfaatMBG https://t.co/z2TCf22eXM;1,90628E+18;https://pbs.twimg.com/media/GnR2pIyawAAuZKP.jpg;;in;Aceh, Indonesia;0;0;0;https://x.com/_pritynica/status/1906278997010641360;1970261042;_pritynica;
1,90555E+18;Fri Mar 28 09:18:47 +0000 2025;643;Negatif;466;Program makan gratis yang bikin orang gak bisa makan... https://t.co/S0xjoNTpWq;1,90555E+18;https://pbs.twimg.com/media/GnHfvLBaEAERT3t.jpg;;in;;13;96;204;https://x.com/ekokuntadhi1/status/1905550121418588678;1,6138E+18;ekokuntadhi1;
1,9061E+18;Sat Mar 29 21:29:06 +0000 2025;0;Negatif;467;Nasi segitu lauk ikan sekecil itu. Ini woi yang kudu lo bagi makan bergizi gratis mah @prabowo Anak sekolah harusnya lo buat bapak mereka dapat gaji layak bukan UMR biar kebutuhan tercukup maksimal dari rumah. Btw sahur apa nih prabs? Enak yaa? Engga ikan sekecil ini kan?;1,9061E+18;;;in;Indonesia;0;0;0;https://x.com/rrnyarrii/status/1906096301353435195;1,0985E+18;rrnyarrii;
1,90468E+18;Tue Mar 25 23:38:13 +0000 2025;1235;Negatif;468;Dengan menyajikan makanan ultra-olahan kepada anak-anak MBG telah menjadi Makan Berbahaya Gratis. Anak-anak itu seperti diajari menu bergizi itu adalah biskuit roti sosis sereal manis hingga minuman berperisa susu. @hariankompas https://t.co/UhrXGazIyA;1,90468E+18;;;in;Kizuki-3 Chome;15;22;786;https://x.com/aik_arif/status/1904679244317548851;218665104;aik_arif;
1,90623E+18;Sun Mar 30 06:17:42 +0000 2025;0;Positif;469;Lebih dari 3 juta anak telah menerima program Makan Bergizi Gratis (MBG). Presiden Prabowo menargetkan 82 9 juta menerima manfaat MBG pada akhir tahun 2025. #MakanBergiziGratis #IndonesiaSehat https://t.co/moZJ7JJ739;1,90623E+18;https://pbs.twimg.com/media/GnRJeUbWsAAnsCW.jpg;;in;Banten, Indonesia;0;0;0;https://x.com/dinosartos/status/1906229329849143493;2506280550;dinosartos;
1,90631E+18;Sun Mar 30 11:49:35 +0000 2025;0;Negatif;470;Polemik MBG (Makan Bergizi Gratis) yang serba gelap dan tidak transparan.. https://t.co/1kjOJ7sKDj;1,90631E+18;;;in;;0;0;0;https://x.com/violettapadma/status/1906312848705479104;8,16986E+17;violettapadma;
1,90637E+18;Sun Mar 30 15:49:46 +0000 2025;0;Positif;471;Program Makan Bergizi Gratis dari Bapak Presiden Prabowo Subianto untuk seluruh anak-anak di Indonesia dari Sabang sd Merauke #PenuhiGiziIndonesia;1,90637E+18;;;in;;0;0;0;https://x.com/rezareva_reza/status/1906373292744962059;1,83676E+18;rezareva_reza;
1,90564E+18;Fri Mar 28 15:22:34 +0000 2025;64;Positif;472;Presiden Prabowo Sebut Banyak Pemimpin Dunia Ingin Mencontoh Makan Bergizi Gratis https://t.co/UUjPFP0tCU;1,90564E+18;;;in;Indonesia;14;164;7;https://x.com/KompasTV/status/1905641674145190106;71436318;KompasTV;
1,90631E+18;Sun Mar 30 11:53:56 +0000 2025;1;Positif;473;Mari bersama dukung program makan bergizi gratis untuk anak-anak Papua. Satu langkah kecil dari kita perubahan besar bagi mereka! https://t.co/0ySWA5o3dN;1,90631E+18;https://pbs.twimg.com/media/GnSWYr8bcAAlTmv.jpg;;in;;0;0;0;https://x.com/Nan4_ecia/status/1906313943313957149;1,75399E+18;Nan4_ecia;
1,9048E+18;Wed Mar 26 07:52:01 +0000 2025;1422;Negatif;474;program MBG (makan bergizi gratis) ? program NKG (nonton konser gratis) ? https://t.co/ZcW8XqWXPH;1,9048E+18;https://pbs.twimg.com/media/Gm84sbCakAAtx6B.jpg;;in;21+ rps;76;42;409;https://x.com/maedaengg/status/1904803511659094473;3085987054;maedaengg;
1,90192E+18;Tue Mar 18 08:57:38 +0000 2025;223;Negatif;475;IMAJINER Boss BEI - Prabowo Boss BEI : IHSG ambruk Pak!! Apa solusinya?? Prabowo: Makan Bergizi Gratis!! https://t.co/60HeFzp7SJ;1,90192E+18;https://pbs.twimg.com/media/GmT6_s4bIAAkIdH.jpg;;in;Jakarta Capital Region;3;42;63;https://x.com/Duren___/status/1901920921910415488;1,50161E+18;Duren___;
1,90628E+18;Sun Mar 30 09:34:38 +0000 2025;0;Netral;476;Makan bergizi gratis untuk anak bangsa???? #MakanBergiziGratis #MBG #ProgramMakanBergiziGratis #ManfaatMBG https://t.co/qbC1QtEU6l;1,90628E+18;https://pbs.twimg.com/media/GnR2iq0asAAWdkG.jpg;;in;Aceh, Indonesia;0;0;0;https://x.com/_pritynica/status/1906278888327757970;1970261042;_pritynica;
1,90634E+18;Sun Mar 30 13:41:14 +0000 2025;0;Positif;477;Tokoh Agama Papua mendukung Program Makan Bergizi Gratis untuk anak-anak Pelajar Selamat Hari Raya Idul Fitri 2025 M Syahrini mudik Ramadhan Dirumah Selamat Lebaran Eid Mubarak Minal Mohon Allah SWT Maafin Taqabbalallahu Minna Wa Minkum Opor Ketupat Rendang pakyandrisusanto https://t.co/vq4dZeERO9;1,90634E+18;https://pbs.twimg.com/media/GnSu-_fbwAAQa0o.jpg;;in;Bogorraincity?;0;0;0;https://x.com/ErlandoFauzi/status/1906340946297704492;215612190;ErlandoFauzi;
1,90618E+18;Sun Mar 30 02:50:00 +0000 2025;95;Netral;478;Presiden Prabowo Cerita Banyak Ditelepon Pemimpin Dunia Tanya Program Makan Bergizi Gratis https://t.co/6MW54mkG3A;1,90618E+18;;;in;Indonesia;35;241;15;https://x.com/KompasTV/status/1906177058096492828;71436318;KompasTV;
